{
  "schema_version": "1",
  "skill_id": "SK-0006",
  "name": "impl-tdd",
  "version": "0.1.0",
  "description": "Implementación test-first (behavioral, opt-in): RED -> GREEN -> REFACTOR con la prueba como contrato de aceptación del cambio. Política opt-in: el implementer aplica TDD cuando la tarea/política lo pide; NO es obligatorio para todas las tareas y no endurece gates.",
  "skill_kind": "behavioral",
  "scope": {
    "target": "project",
    "description": "Implementación de tareas en SYSTEM-ENGINEERING con disciplina test-first opt-in"
  },
  "restrictions": [
    "Opt-in: solo aplica si la tarea/política lo declara; no es gate",
    "NO relaja la autoridad de cierre de se verify G5",
    "NO escribe la prueba para que pase sin verificar el caso"
  ],
  "usage_rules": [
    {
      "rule": "Ciclo RED->GREEN->REFACTOR: escribir el test fallando, verlo fallar, mínimo cambio para pasar, refactor con suite verde."
    },
    {
      "rule": "Registrar en la EVD/reporte G5 el modo test-first usado (tests + resultado)."
    }
  ],
  "capabilities": {
    "required": ["filesystem.read", "filesystem.search"],
    "optional": ["filesystem.write", "structured.reasoning", "documentation.lookup"]
  },
  "constraints": {
    "write": "allowed"
  },
  "metadata": {
    "checkpoint": "CP-023",
    "adapter": "opencode",
    "ecosystem": "ECH-002-SEED-2"
  }
}